,Tittle,Authors,Year,Cited,Link_detail
91,Vietnamese Sentiment Analysis: An Overview and Comparative Study of Fine-tuning Pretrained Language Models,"D Van Thin, DN Hao, NLT Nguyen",2023,,https://scholar.google.com/citations?view_op=view_citation&hl=en&user=VoTCbXYAAAAJ&cstart=20&pagesize=80&citation_for_view=VoTCbXYAAAAJ:eJXPG6dFmWUC
92,A dynamic capabilities approach of Industry 4.0: the experiences of managers operating in two emerging economies,"OTK Vu, AD Alonso, MAB Solis, S Goyzueta, T Nguyen, R McClelland, ...",2022,,https://scholar.google.com/citations?view_op=view_citation&hl=en&user=VoTCbXYAAAAJ&cstart=20&pagesize=80&citation_for_view=VoTCbXYAAAAJ:WbkHhVStYXYC
93,Is word segmentation necessary for Vietnamese sentiment classification?,"DV Nguyen, NLT Nguyen",2022,,https://scholar.google.com/citations?view_op=view_citation&hl=en&user=VoTCbXYAAAAJ&cstart=20&pagesize=80&citation_for_view=VoTCbXYAAAAJ:l7t_Zn2s7bgC
94,vnNLI-VLSP 2021: Vietnamese and English-Vietnamese Textual Entailment Based on Pre-trained Multilingual Language Models,"HX Vu, N Van Tai, PTK Khoa, D Van Thin, DN Hao, NLT Ngan",2022,,https://scholar.google.com/citations?view_op=view_citation&hl=en&user=VoTCbXYAAAAJ&cstart=20&pagesize=80&citation_for_view=VoTCbXYAAAAJ:738O_yMBCRsC
95,vnNLI-VLSP2021: An Empirical Study on Vietnamese-English Natural Language Inference Based on Pretrained Language Models with Data Augmentation,"ND Luan, NLH Kien, D Van Thin, DN Hao, NLT Ngan",2022,,https://scholar.google.com/citations?view_op=view_citation&hl=en&user=VoTCbXYAAAAJ&cstart=20&pagesize=80&citation_for_view=VoTCbXYAAAAJ:XiSMed-E-HIC
96,Error Investigation of Pre-trained BERTology Models on Vietnamese Natural Language Inference,"T Van Huynh, HQ To, K Van Nguyen, NLT Nguyen",2022,,https://scholar.google.com/citations?view_op=view_citation&hl=en&user=VoTCbXYAAAAJ&cstart=20&pagesize=80&citation_for_view=VoTCbXYAAAAJ:uWQEDVKXjbEC
97,A Comparative Study of Question Answering over Knowledge Bases,"KV Tran, HP Phan, KND Quach, NLT Nguyen, J Jo, TT Nguyen",2022,,https://scholar.google.com/citations?view_op=view_citation&hl=en&user=VoTCbXYAAAAJ&cstart=20&pagesize=80&citation_for_view=VoTCbXYAAAAJ:SP6oXDckpogC
98,Impacts of Transformer-Based Language Models and Imbalanced Data for Hate Speech Detection on Vietnamese Social Media Texts,"ST Luu, K Van Nguyen, NLT Nguyen",2022,,https://scholar.google.com/citations?view_op=view_citation&hl=en&user=VoTCbXYAAAAJ&cstart=20&pagesize=80&citation_for_view=VoTCbXYAAAAJ:UxriW0iASnsC
99,An Effective Contextual Language Ensemble Model for Vietnamese Aspect-based Sentiment Analysis,"D Van Thin, DN Hao, NLT Nguyen",2022,,https://scholar.google.com/citations?view_op=view_citation&hl=en&user=VoTCbXYAAAAJ&cstart=20&pagesize=80&citation_for_view=VoTCbXYAAAAJ:vRqMK49ujn8C
100,Leveraging Semantic Representations Combined with Contextual Word Representations for Recognizing Textual Entailment in Vietnamese,"QL Duong, DV Nguyen, NLT Nguyen",2022,,https://scholar.google.com/citations?view_op=view_citation&hl=en&user=VoTCbXYAAAAJ&cstart=100&pagesize=100&citation_for_view=VoTCbXYAAAAJ:08ZZubdj9fEC
101,Integrating Semantic Information into Sketchy Reading Module of Retro-Reader for Vietnamese Machine Reading Comprehension,"HTT Le, VD Ho, DV Nguyen, NLT Nguyen",2022,,https://scholar.google.com/citations?view_op=view_citation&hl=en&user=VoTCbXYAAAAJ&cstart=100&pagesize=100&citation_for_view=VoTCbXYAAAAJ:tOudhMTPpwUC
102,ViEmBot: An Empathetic Voicebot System for the Vietnamese Language,"DL Toan, TTT Pham, T Dang, NLT Nguyen",2022,,https://scholar.google.com/citations?view_op=view_citation&hl=en&user=VoTCbXYAAAAJ&cstart=100&pagesize=100&citation_for_view=VoTCbXYAAAAJ:dshw04ExmUIC
103,SMTCE: A Social Media Text Classification Evaluation Benchmark and BERTology Models for Vietnamese,"LT Nguyen, K Van Nguyen, NLT Nguyen",2022,,https://scholar.google.com/citations?view_op=view_citation&hl=en&user=VoTCbXYAAAAJ&cstart=100&pagesize=100&citation_for_view=VoTCbXYAAAAJ:nb7KW1ujOQ8C
104,""" Some other poor soul's problems"": a peer recommendation intervention for health-related social support","Z Levonian, M Zent, N Nguyen, M McNamara, L Terveen, S Yarosh",2022,,https://scholar.google.com/citations?view_op=view_citation&hl=en&user=VoTCbXYAAAAJ&cstart=100&pagesize=100&citation_for_view=VoTCbXYAAAAJ:P5F9QuxV20EC
105,A Comparative Study of Question Answering over Knowledge Bases (preprint),"KV Tran, HP Phan, KND Quach, NLT Nguyen, J Jo, TT Nguyen",2022,,https://scholar.google.com/citations?view_op=view_citation&hl=en&user=VoTCbXYAAAAJ&cstart=100&pagesize=100&citation_for_view=VoTCbXYAAAAJ:sSrBHYA8nusC
106,DeepO: an ontology-based deep learning system for disease prediction,"TPT Nguyen, NLT Nguyen, TH Duong",2022,,https://scholar.google.com/citations?view_op=view_citation&hl=en&user=VoTCbXYAAAAJ&cstart=100&pagesize=100&citation_for_view=VoTCbXYAAAAJ:f2IySw72cVMC
107,Joint Chinese Word Segmentation and Part-of-speech Tagging via Two-stage Span Labeling,"DV Nguyen, LB Vo, NL Tran, K Van Nguyen, NLT Nguyen",2021,,https://scholar.google.com/citations?view_op=view_citation&hl=en&user=VoTCbXYAAAAJ&cstart=100&pagesize=100&citation_for_view=VoTCbXYAAAAJ:cFHS6HbyZ2cC
108,W-NUT@ EMNLP-UIT-HSE at WNUT-2020 Task 2: Exploiting CT-BERT for Identifying COVID-19 Information on the Twitter Social Network,"K Tran, H Phan, K Van Nguyen, N Nguyen",2021,,https://scholar.google.com/citations?view_op=view_citation&hl=en&user=VoTCbXYAAAAJ&cstart=100&pagesize=100&citation_for_view=VoTCbXYAAAAJ:LPZeul_q3PIC
109,Augmenting Part-of-speech Tagging with Syntactic Information for Vietnamese and Chinese,"DV Nguyen, K Van Nguyen, NLT Nguyen",2021,,https://scholar.google.com/citations?view_op=view_citation&hl=en&user=VoTCbXYAAAAJ&cstart=100&pagesize=100&citation_for_view=VoTCbXYAAAAJ:lSLTfruPkqcC
110,UIT-HSE at WNUT-2020 Task 2: Exploiting CT-BERT for Identifying COVID-19 Information on the Twitter Social Network (preprint),"KV Tran, HP Phan, K Van Nguyen, NLT Nguyen",2020,,https://scholar.google.com/citations?view_op=view_citation&hl=en&user=VoTCbXYAAAAJ&cstart=100&pagesize=100&citation_for_view=VoTCbXYAAAAJ:geHnlv5EZngC
111,Vietnamese transition-based dependency parsing with supertag features,"K Van Nguyen, NLT Nguyen",2019,,https://scholar.google.com/citations?view_op=view_citation&hl=en&user=VoTCbXYAAAAJ&cstart=100&pagesize=100&citation_for_view=VoTCbXYAAAAJ:j3f4tGmQtD8C
112,Exploring alignment-classification methods in the context of professional writing assistance,"M Duong, MQ Nghiem, NLT Nguyen",2018,,https://scholar.google.com/citations?view_op=view_citation&hl=en&user=VoTCbXYAAAAJ&cstart=100&pagesize=100&citation_for_view=VoTCbXYAAAAJ:2osOgNQ5qMEC
113,Alignment classification for professional writing assistance,"M Duong, MQ Nghiem, NLT Nguyen",2016,,https://scholar.google.com/citations?view_op=view_citation&hl=en&user=VoTCbXYAAAAJ&cstart=100&pagesize=100&citation_for_view=VoTCbXYAAAAJ:0EnyYjriUFMC
114,The Impact of Ownership Structure on Capital Structure Decision: Empirical Evidence from Vietnamese Listed Firms,"TPV Le, K Tannous, N Nguyen",2014,,https://scholar.google.com/citations?view_op=view_citation&hl=en&user=VoTCbXYAAAAJ&cstart=100&pagesize=100&citation_for_view=VoTCbXYAAAAJ:OU6Ihb5iCvQC
115,A Corpus for Studies on Scientific Writing Assistance,N Nguyen,2013,,https://scholar.google.com/citations?view_op=view_citation&hl=en&user=VoTCbXYAAAAJ&cstart=100&pagesize=100&citation_for_view=VoTCbXYAAAAJ:u-x6o8ySG0sC
116,""" NaCTeM (National Centre for Text Mining), Manchester Interdisciplinary Biocentre, University of Manchester, 13/Princess St, MANCHESTER MI 7DN, UK","A TOOL, UPP COMPARATOR, Y KANO, N NGUYEN, R SETRE, ...",2008,,https://scholar.google.com/citations?view_op=view_citation&hl=en&user=VoTCbXYAAAAJ&cstart=100&pagesize=100&citation_for_view=VoTCbXYAAAAJ:YOwf2qJgpHMC
117,A hybrid approach to word order transfer in the English-to-Vietnamese machine translation,"D Dien, NLT Ngan",2003,,https://scholar.google.com/citations?view_op=view_citation&hl=en&user=VoTCbXYAAAAJ&cstart=100&pagesize=100&citation_for_view=VoTCbXYAAAAJ:Tiz5es2fbqcC
118,3 Peer Reviewed,"C Engel, JA Frankel",1990,,https://scholar.google.com/citations?view_op=view_citation&hl=en&user=VoTCbXYAAAAJ&cstart=100&pagesize=100&citation_for_view=VoTCbXYAAAAJ:1sJd4Hv_s6UC
119,Downloaded from: http://e-space. mmu. ac. uk/621050,"MJ Shardlow, N Nguyen, G Owen, C O’Donovan, A Leach, J McNaught, ...",,,https://scholar.google.com/citations?view_op=view_citation&hl=en&user=VoTCbXYAAAAJ&cstart=100&pagesize=100&citation_for_view=VoTCbXYAAAAJ:D_sINldO8mEC
120,Gender Inequalities in Health Status and Service Utilization of Migrant Workers in Three Large Industrial Zones of Vietnam,"HN Do, N Nguyen, C Agha, AT Nguyen, HQT Nguyen, TP Bui, QV Nguyen, ...",,,https://scholar.google.com/citations?view_op=view_citation&hl=en&user=VoTCbXYAAAAJ&cstart=100&pagesize=100&citation_for_view=VoTCbXYAAAAJ:xtRiw3GOFMkC
121,Ch ll i P R l ti Ch ll i P R l ti Challenges in Pronoun Resolution System for Biomedical Text y,"N Nguyen, JD Kim, JTN Nguyen, JD Kim, J ichi Tsujii",,,https://scholar.google.com/citations?view_op=view_citation&hl=en&user=VoTCbXYAAAAJ&cstart=100&pagesize=100&citation_for_view=VoTCbXYAAAAJ:YsMSGLbcyi4C
122,Machine Learning Based Pronoun Resolution for Biomedical Text,"NLT Nguyen, Y Miyao, JD Kim, J Tsujii",,,https://scholar.google.com/citations?view_op=view_citation&hl=en&user=VoTCbXYAAAAJ&cstart=100&pagesize=100&citation_for_view=VoTCbXYAAAAJ:Tyk-4Ss8FVUC
