,Tittle,Authors,Year,Cited,Link_detail
0,Overview of BioNLP’09 shared task on event extraction,"JD Kim, T Ohta, S Pyysalo, Y Kano, J Tsujii",2009,776,https://scholar.google.com/citations?view_op=view_citation&hl=en&user=VoTCbXYAAAAJ&citation_for_view=VoTCbXYAAAAJ:KlAtU1dfN6UC
1,The genia event and protein coreference tasks of the BioNLP shared task 2011,"JD Kim, N Nguyen, Y Wang, J Tsujii, T Takagi, A Yonezawa",2012,110,https://scholar.google.com/citations?view_op=view_citation&hl=en&user=VoTCbXYAAAAJ&citation_for_view=VoTCbXYAAAAJ:UebtZRa9Y70C
2,UIT-VSFC: Vietnamese students’ feedback corpus for sentiment analysis,"K Van Nguyen, VD Nguyen, PXV Nguyen, TTH Truong, NLT Nguyen",2018,50,https://scholar.google.com/citations?view_op=view_citation&hl=en&user=VoTCbXYAAAAJ&citation_for_view=VoTCbXYAAAAJ:qxL8FJ1GzNcC
3,Emotion recognition for vietnamese social media text,"VA Ho, DHC Nguyen, DH Nguyen, LTV Pham, DV Nguyen, KV Nguyen, ...",2020,45,https://scholar.google.com/citations?view_op=view_citation&hl=en&user=VoTCbXYAAAAJ&citation_for_view=VoTCbXYAAAAJ:hC7cP41nSMkC
4,Deep learning versus traditional classifiers on Vietnamese students’ feedback corpus,"PXV Nguyen, TTT Hong, K Van Nguyen, NLT Nguyen",2018,36,https://scholar.google.com/citations?view_op=view_citation&hl=en&user=VoTCbXYAAAAJ&citation_for_view=VoTCbXYAAAAJ:4TOpqqG69KYC
5,Hate speech detection on vietnamese social media text using the bi-gru-lstm-cnn model,"T Van Huynh, VD Nguyen, K Van Nguyen, NLT Nguyen, AGT Nguyen",2019,35,https://scholar.google.com/citations?view_op=view_citation&hl=en&user=VoTCbXYAAAAJ&citation_for_view=VoTCbXYAAAAJ:L8Ckcad2t8MC
6,A Vietnamese dataset for evaluating machine reading comprehension,"K Nguyen, V Nguyen, A Nguyen, N Nguyen",2020,31,https://scholar.google.com/citations?view_op=view_citation&hl=en&user=VoTCbXYAAAAJ&citation_for_view=VoTCbXYAAAAJ:GnPB-g6toBAC
7,Modeling in the time of COVID-19: Statistical and rule-based mesoscale models,"N Nguyen, O Strnad, T Klein, D Luo, R Alharbi, P Wonka, M Maritan, ...",2021,30,https://scholar.google.com/citations?view_op=view_citation&hl=en&user=VoTCbXYAAAAJ&citation_for_view=VoTCbXYAAAAJ:D03iK_w7-QYC
8,Job prediction: From deep neural network models to applications,"T Van Huynh, K Van Nguyen, NLT Nguyen, AGT Nguyen",2020,25,https://scholar.google.com/citations?view_op=view_citation&hl=en&user=VoTCbXYAAAAJ&citation_for_view=VoTCbXYAAAAJ:mB3voiENLucC
9,Variants of long short-term memory for sentiment analysis on Vietnamese students’ feedback corpus,"VD Nguyen, K Van Nguyen, NLT Nguyen",2018,25,https://scholar.google.com/citations?view_op=view_citation&hl=en&user=VoTCbXYAAAAJ&citation_for_view=VoTCbXYAAAAJ:Wp0gIr-vW9MC
10,Proceedings of the BioNLP Shared Task 2011 Workshop,"JD Kim, S Pyysalo, T Ohta, R Bossy, N Nguyen, J Tsujii",2011,24,https://scholar.google.com/citations?view_op=view_citation&hl=en&user=VoTCbXYAAAAJ&citation_for_view=VoTCbXYAAAAJ:hqOjcs7Dif8C
11,"Filling the gaps between tools and users: a tool comparator, using protein-protein interaction as an example","Y Kano, N Nguyen, R Saetre, K Yoshida, Y Miyao, Y Tsuruoka, ...",2008,23,https://scholar.google.com/citations?view_op=view_citation&hl=en&user=VoTCbXYAAAAJ&citation_for_view=VoTCbXYAAAAJ:W7OEmFMy1HYC
12,Enhancing lexical-based approach with external knowledge for Vietnamese multiple-choice machine reading comprehension,"K Van Nguyen, KV Tran, ST Luu, AGT Nguyen, NLT Nguyen",2020,22,https://scholar.google.com/citations?view_op=view_citation&hl=en&user=VoTCbXYAAAAJ&citation_for_view=VoTCbXYAAAAJ:YFjsv_pBGBYC
13,Exploring domain differences for the design of a pronoun resolution system for biomedical text,"NLT Nguyen, JD Kim",2008,22,https://scholar.google.com/citations?view_op=view_citation&hl=en&user=VoTCbXYAAAAJ&citation_for_view=VoTCbXYAAAAJ:roLk4NBRz8UC
14,Effective attention-based neural architectures for sentence compression with bidirectional long short-term memory,"NT Tran, VT Luong, NLT Nguyen, MQ Nghiem",2016,20,https://scholar.google.com/citations?view_op=view_citation&hl=en&user=VoTCbXYAAAAJ&citation_for_view=VoTCbXYAAAAJ:IjCSPb-OGe4C
15,Improving protein coreference resolution by simple semantic classification,"N Nguyen, JD Kim, M Miwa, T Matsuzaki, J Tsujii",2012,20,https://scholar.google.com/citations?view_op=view_citation&hl=en&user=VoTCbXYAAAAJ&citation_for_view=VoTCbXYAAAAJ:eQOLeE2rZwMC
16,Hate speech detection on vietnamese social media text using the bidirectional-lstm model,"HTT Do, HD Huynh, K Van Nguyen, NLT Nguyen, AGT Nguyen",2019,19,https://scholar.google.com/citations?view_op=view_citation&hl=en&user=VoTCbXYAAAAJ&citation_for_view=VoTCbXYAAAAJ:IWHjjKOFINEC
17,Overview of the protein coreference task in BioNLP shared task 2011,"N Nguyen, JD Kim, J Tsujii",2011,19,https://scholar.google.com/citations?view_op=view_citation&hl=en&user=VoTCbXYAAAAJ&citation_for_view=VoTCbXYAAAAJ:UeHWp8X0CEIC
18,New Vietnamese corpus for machine reading comprehension of health news articles,"K Van Nguyen, T Van Huynh, DV Nguyen, AGT Nguyen, NLT Nguyen",2022,18,https://scholar.google.com/citations?view_op=view_citation&hl=en&user=VoTCbXYAAAAJ&citation_for_view=VoTCbXYAAAAJ:r0BpntZqJG4C
19,A large-scale dataset for hate speech detection on vietnamese social media texts,"ST Luu, KV Nguyen, NLT Nguyen",2021,18,https://scholar.google.com/citations?view_op=view_citation&hl=en&user=VoTCbXYAAAAJ&citation_for_view=VoTCbXYAAAAJ:70eg2SAEIzsC
20,Overview of BioNLP 2011 protein coreference shared task,"N Nguyen, JD Kim, J Tsujii",2011,18,https://scholar.google.com/citations?view_op=view_citation&hl=en&user=VoTCbXYAAAAJ&cstart=20&pagesize=80&citation_for_view=VoTCbXYAAAAJ:d1gkVwhDpl0C
21,Constructive and toxic speech detection for open-domain social media comments in vietnamese,"LT Nguyen, K Van Nguyen, NLT Nguyen",2021,15,https://scholar.google.com/citations?view_op=view_citation&hl=en&user=VoTCbXYAAAAJ&cstart=20&pagesize=80&citation_for_view=VoTCbXYAAAAJ:35N4QoGY0k4C
22,A transformation method for aspect-based sentiment analysis,"T Van Dang, VD Nguyen, N Van Kiet, NLT Ngan",2018,14,https://scholar.google.com/citations?view_op=view_citation&hl=en&user=VoTCbXYAAAAJ&cstart=20&pagesize=80&citation_for_view=VoTCbXYAAAAJ:K3LRdlH-MEoC
23,Two new large corpora for vietnamese aspect-based sentiment analysis at sentence level,"D Van Thin, NLT Nguyen, TM Truong, LS Le, DT Vo",2021,13,https://scholar.google.com/citations?view_op=view_citation&hl=en&user=VoTCbXYAAAAJ&cstart=20&pagesize=80&citation_for_view=VoTCbXYAAAAJ:SeFeTyx0c_EC
24,Comparison between traditional machine learning models and neural network models for vietnamese hate speech detection,"ST Luu, HP Nguyen, K Van Nguyen, NLT Nguyen",2020,13,https://scholar.google.com/citations?view_op=view_citation&hl=en&user=VoTCbXYAAAAJ&cstart=20&pagesize=80&citation_for_view=VoTCbXYAAAAJ:R3hNpaxXUhUC
25,Challenges in Pronoun Resolution System for Biomedical Text.,"NLT Nguyen, JD Kim, Jun'ichi Tsujii",2008,13,https://scholar.google.com/citations?view_op=view_citation&hl=en&user=VoTCbXYAAAAJ&cstart=20&pagesize=80&citation_for_view=VoTCbXYAAAAJ:LkGwnXOMwfcC
26,Deep learning for aspect detection on vietnamese reviews,"D Van Thin, VD Nguye, K Van Nguyen, NLT Nguyen",2018,12,https://scholar.google.com/citations?view_op=view_citation&hl=en&user=VoTCbXYAAAAJ&cstart=20&pagesize=80&citation_for_view=VoTCbXYAAAAJ:M3ejUd6NZC8C
27,Open information extraction from biomedical literature using predicate-argument structure patterns,"N Nguyen, M Miwa, Y Tsuruoka, S Tojo",2013,12,https://scholar.google.com/citations?view_op=view_citation&hl=en&user=VoTCbXYAAAAJ&cstart=20&pagesize=80&citation_for_view=VoTCbXYAAAAJ:7PzlFSSx8tAC
28,Monolingual versus multilingual bertology for vietnamese extractive multi-document summarization,"HQ To, K Van Nguyen, NLT Nguyen, AGT Nguyen",2021,11,https://scholar.google.com/citations?view_op=view_citation&hl=en&user=VoTCbXYAAAAJ&cstart=20&pagesize=80&citation_for_view=VoTCbXYAAAAJ:zA6iFVUQeVQC
29,A simple and efficient ensemble classifier combining multiple neural network models on social media datasets in Vietnamese,"HD Huynh, HTT Do, K Van Nguyen, NLT Nguyen",2020,11,https://scholar.google.com/citations?view_op=view_citation&hl=en&user=VoTCbXYAAAAJ&cstart=20&pagesize=80&citation_for_view=VoTCbXYAAAAJ:M3NEmzRMIkIC
30,UIT-HSE at WNUT-2020 task 2: exploiting CT-BERT for identifying COVID-19 information on the twitter social network,"KV Tran, HP Phan, K Van Nguyen, NLT Nguyen",2020,11,https://scholar.google.com/citations?view_op=view_citation&hl=en&user=VoTCbXYAAAAJ&cstart=20&pagesize=80&citation_for_view=VoTCbXYAAAAJ:isC4tDSrTZIC
31,Vietnamese transition-based dependency parsing with supertag features,"KV Nguyen, NLT Nguyen",2016,11,https://scholar.google.com/citations?view_op=view_citation&hl=en&user=VoTCbXYAAAAJ&cstart=20&pagesize=80&citation_for_view=VoTCbXYAAAAJ:ufrVoPGSRksC
32,Error analysis for vietnamese dependency parsing,"K Van Nguyen, NLT Nguyen",2015,11,https://scholar.google.com/citations?view_op=view_citation&hl=en&user=VoTCbXYAAAAJ&cstart=20&pagesize=80&citation_for_view=VoTCbXYAAAAJ:qjMakFHDy7sC
33,Vireader: A wikipedia-based vietnamese reading comprehension system using transfer learning,"K Van Nguyena, N Duy Nguyena, P Nguyen-Thuan Doa, ...",2021,9,https://scholar.google.com/citations?view_op=view_citation&hl=en&user=VoTCbXYAAAAJ&cstart=20&pagesize=80&citation_for_view=VoTCbXYAAAAJ:b0M2c_1WBrUC
34,Empirical study of text augmentation on social media text in vietnamese,"ST Luu, K Van Nguyen, NLT Nguyen",2020,9,https://scholar.google.com/citations?view_op=view_citation&hl=en&user=VoTCbXYAAAAJ&cstart=20&pagesize=80&citation_for_view=VoTCbXYAAAAJ:maZDTaKrznsC
35,A corpus for aspect-based sentiment analysis in Vietnamese,"MH Nguyen, TM Nguyen, D Van Thin, NLT Nguyen",2019,9,https://scholar.google.com/citations?view_op=view_citation&hl=en&user=VoTCbXYAAAAJ&cstart=20&pagesize=80&citation_for_view=VoTCbXYAAAAJ:-f6ydRqryjwC
36,Comparing different criteria for Vietnamese word segmentation,"Q Nguyen, NLT Nguyen, Y Miyao",2012,9,https://scholar.google.com/citations?view_op=view_citation&hl=en&user=VoTCbXYAAAAJ&cstart=20&pagesize=80&citation_for_view=VoTCbXYAAAAJ:_kc_bZDykSQC
37,Uit-viic: A dataset for the first evaluation on vietnamese image captioning,"QH Lam, QD Le, VK Nguyen, NLT Nguyen",2020,8,https://scholar.google.com/citations?view_op=view_citation&hl=en&user=VoTCbXYAAAAJ&cstart=20&pagesize=80&citation_for_view=VoTCbXYAAAAJ:e5wmG9Sq2KIC
38,Question Answering System for Entrance Exams in QA4MRE.,"X Li, R Tian, NLT Nguyen, Y Miyao, A Aizawa",2013,8,https://scholar.google.com/citations?view_op=view_citation&hl=en&user=VoTCbXYAAAAJ&cstart=20&pagesize=80&citation_for_view=VoTCbXYAAAAJ:5nxA0vEk-isC
39,Jun’ichi Tsujii. 2011. Overview of the Protein Coreference task in BioNLP Shared Task 2011,"N Nguyen, JD Kim",2011,8,https://scholar.google.com/citations?view_op=view_citation&hl=en&user=VoTCbXYAAAAJ&cstart=20&pagesize=80&citation_for_view=VoTCbXYAAAAJ:u5HHmVD_uO8C
40,A comparison of digital chest radiography and Xpert® MTB/RIF in active case finding for tuberculosis,"TBP Nguyen, TA Nguyen, BK Luu, TTO Le, VS Nguyen, KC Nguyen, ...",2020,7,https://scholar.google.com/citations?view_op=view_citation&hl=en&user=VoTCbXYAAAAJ&cstart=20&pagesize=80&citation_for_view=VoTCbXYAAAAJ:blknAaTinKkC
41,Nlp@ uit: Exploring feature engineer and ensemble model for hate speech detection at vlsp 2019,"D Van Thin, LS Le, NLT Nguyen",1991,7,https://scholar.google.com/citations?view_op=view_citation&hl=en&user=VoTCbXYAAAAJ&cstart=20&pagesize=80&citation_for_view=VoTCbXYAAAAJ:ZeXyd9-uunAC
42,Jun’ichi Tsujii. 2011. Overview of BioNLP 2011 protein coreference shared task,"N Nguyen, JD Kim",,7,https://scholar.google.com/citations?view_op=view_citation&hl=en&user=VoTCbXYAAAAJ&cstart=20&pagesize=80&citation_for_view=VoTCbXYAAAAJ:ldfaerwXgEUC
43,Vietnamese open-domain complaint detection in e-commerce websites,"NTH Nguyen, PHD Phan, LT Nguyen, K Van Nguyen, NLT Nguyen",2021,6,https://scholar.google.com/citations?view_op=view_citation&hl=en&user=VoTCbXYAAAAJ&cstart=20&pagesize=80&citation_for_view=VoTCbXYAAAAJ:g5m5HwL7SMYC
44,Gender prediction based on vietnamese names with machine learning techniques,"HQ To, KV Nguyen, NLT Nguyen, AGT Nguyen",2020,6,https://scholar.google.com/citations?view_op=view_citation&hl=en&user=VoTCbXYAAAAJ&cstart=20&pagesize=80&citation_for_view=VoTCbXYAAAAJ:NMxIlDl6LWMC
45,Multi-task learning for aspect and polarity recognition on vietnamese datasets,"D Van Thin, DV Nguyen, K Van Nguyen, NLT Nguyen, AHT Nguyen",2020,6,https://scholar.google.com/citations?view_op=view_citation&hl=en&user=VoTCbXYAAAAJ&cstart=20&pagesize=80&citation_for_view=VoTCbXYAAAAJ:bEWYMUwI8FkC
46,Error analysis for vietnamese named entity recognition on deep neural network models,"BA Nguyen, K Van Nguyen, NLT Nguyen",2019,6,https://scholar.google.com/citations?view_op=view_citation&hl=en&user=VoTCbXYAAAAJ&cstart=20&pagesize=80&citation_for_view=VoTCbXYAAAAJ:qUcmZB5y_30C
47,LSTM easy-first dependency parsing with pre-trained word embeddings and character-level word embeddings in Vietnamese,"BD Nguyen, K Van Nguyen, NLT Nguyen",2018,6,https://scholar.google.com/citations?view_op=view_citation&hl=en&user=VoTCbXYAAAAJ&cstart=20&pagesize=80&citation_for_view=VoTCbXYAAAAJ:4DMP91E08xMC
48,Nlp@ uit at VLSP 2018: A supervised method for aspect based sentiment analysis,"TD Van, KV Nguyen, NLT Nguyen",2018,6,https://scholar.google.com/citations?view_op=view_citation&hl=en&user=VoTCbXYAAAAJ&cstart=20&pagesize=80&citation_for_view=VoTCbXYAAAAJ:O3NaXMp0MMsC
49,Challenges and solutions for consistent annotation of Vietnamese treebank,"Q Nguyen, Y Miyao, H Le, N Nguyen",2016,6,https://scholar.google.com/citations?view_op=view_citation&hl=en&user=VoTCbXYAAAAJ&cstart=20&pagesize=80&citation_for_view=VoTCbXYAAAAJ:9yKSN-GCB0IC
50,UIT-ISE-NLP at SemEval-2021 task 5: Toxic spans detection with BiLSTM-CRF and ToxicBERT comment classification,"ST Luu, NLT Nguyen",2021,5,https://scholar.google.com/citations?view_op=view_citation&hl=en&user=VoTCbXYAAAAJ&cstart=20&pagesize=80&citation_for_view=VoTCbXYAAAAJ:M05iB0D1s5AC
51,An experimental study of deep neural network models for vietnamese multiple-choice reading comprehension,"ST Luu, K Van Nguyen, AGT Nguyen, NLT Nguyen",2021,5,https://scholar.google.com/citations?view_op=view_citation&hl=en&user=VoTCbXYAAAAJ&cstart=20&pagesize=80&citation_for_view=VoTCbXYAAAAJ:TFP_iSt0sucC
52,ViMs: a high-quality Vietnamese dataset for abstractive multi-document summarization,"NT Tran, MQ Nghiem, NTH Nguyen, NLT Nguyen, N Van Chi, D Dinh",2020,5,https://scholar.google.com/citations?view_op=view_citation&hl=en&user=VoTCbXYAAAAJ&cstart=20&pagesize=80&citation_for_view=VoTCbXYAAAAJ:iH-uZ7U-co4C
53,Utilizing state-of-the-art parsers to diagnose problems in treebank annotation for a less resourced language,"Q Nguyen, N Nguyen, Y Miyao",2013,5,https://scholar.google.com/citations?view_op=view_citation&hl=en&user=VoTCbXYAAAAJ&cstart=20&pagesize=80&citation_for_view=VoTCbXYAAAAJ:MXK_kJrjxJIC
54,Towards Data And Goal Oriented Analysis: Tool Inter-Operability And Combinatorial Comparison,"Y Kano, N Nguyen, R Sætre, K Yoshida, K Fukamachi, Y Miyao, ...",2008,5,https://scholar.google.com/citations?view_op=view_citation&hl=en&user=VoTCbXYAAAAJ&cstart=20&pagesize=80&citation_for_view=VoTCbXYAAAAJ:kNdYIx-mwKoC
55,Investigating monolingual and multilingual BERT models for Vietnamese aspect category detection,"D Van Thin, DN Hao, VX Hoang, NLT Nguyen",2022,4,https://scholar.google.com/citations?view_op=view_citation&hl=en&user=VoTCbXYAAAAJ&cstart=20&pagesize=80&citation_for_view=VoTCbXYAAAAJ:vV6vV6tmYwMC
56,Sentence extraction-based machine reading comprehension for Vietnamese,"PNT Do, ND Nguyen, T Van Huynh, K Van Nguyen, AGT Nguyen, ...",2021,4,https://scholar.google.com/citations?view_op=view_citation&hl=en&user=VoTCbXYAAAAJ&cstart=20&pagesize=80&citation_for_view=VoTCbXYAAAAJ:HoB7MX3m0LUC
57,Conversational machine reading comprehension for vietnamese healthcare texts,"ST Luu, MN Bui, LD Nguyen, KV Tran, K Van Nguyen, NLT Nguyen",2021,4,https://scholar.google.com/citations?view_op=view_citation&hl=en&user=VoTCbXYAAAAJ&cstart=20&pagesize=80&citation_for_view=VoTCbXYAAAAJ:pqnbT2bcN3wC
58,"An investigation on design innovation, fabrication and experiment of a soybean peeling machine-scale","VTT Nguyen, VA Dang, NT Tran, NC Hoang, DH Vo, DK Nguyen, ...",2018,4,https://scholar.google.com/citations?view_op=view_citation&hl=en&user=VoTCbXYAAAAJ&cstart=20&pagesize=80&citation_for_view=VoTCbXYAAAAJ:a0OBvERweLwC
59,Improving Vietnamese sentence compression by segmenting meaning chunks,"NT Tran, VG Ung, AV Luong, MQ Nghiem, NLT Nguyen",2015,4,https://scholar.google.com/citations?view_op=view_citation&hl=en&user=VoTCbXYAAAAJ&cstart=20&pagesize=80&citation_for_view=VoTCbXYAAAAJ:8k81kl-MbHgC
60,Alignment-based annotation of proofreading texts toward professional writing assistance,"N Nguyen, Y Miyao",2013,4,https://scholar.google.com/citations?view_op=view_citation&hl=en&user=VoTCbXYAAAAJ&cstart=20&pagesize=80&citation_for_view=VoTCbXYAAAAJ:WF5omc3nYNoC
61,Sharable type system design for tool inter-operability and combinatorial comparison,"Y Kano, N Nguyen, R Sætre, K Fukamachi, KYY Miyao, Y Tsuruoka, ...",2008,4,https://scholar.google.com/citations?view_op=view_citation&hl=en&user=VoTCbXYAAAAJ&cstart=20&pagesize=80&citation_for_view=VoTCbXYAAAAJ:Y0pCki6q_DkC
62,VLSP 2021-ViMRC Challenge: Vietnamese Machine Reading Comprehension,"N Van Kiet, TQ Son, NT Luan, H Van Tin, LT Son, NLT Ngan",2022,3,https://scholar.google.com/citations?view_op=view_citation&hl=en&user=VoTCbXYAAAAJ&cstart=20&pagesize=80&citation_for_view=VoTCbXYAAAAJ:u9iWguZQMMsC
63,ViNLI: a Vietnamese corpus for studies on open-domain natural language inference,"T Van Huynh, K Van Nguyen, NLT Nguyen",2022,3,https://scholar.google.com/citations?view_op=view_citation&hl=en&user=VoTCbXYAAAAJ&cstart=20&pagesize=80&citation_for_view=VoTCbXYAAAAJ:KxtntwgDAa4C
64,A joint multi-task architecture for document-level aspect-based sentiment analysis in vietnamese,"D Van Thin, LS Le, HM Nguyen, NLT Nguyen",2022,3,https://scholar.google.com/citations?view_op=view_citation&hl=en&user=VoTCbXYAAAAJ&cstart=20&pagesize=80&citation_for_view=VoTCbXYAAAAJ:yD5IFk8b50cC
65,Vietnamese complaint detection on e-commerce websites,"NTH Nguyen, PPD Ha, LT Nguyen, K Van Nguyen, NLT Nguyen",2021,3,https://scholar.google.com/citations?view_op=view_citation&hl=en&user=VoTCbXYAAAAJ&cstart=20&pagesize=80&citation_for_view=VoTCbXYAAAAJ:fPk4N6BV_jEC
66,Vietnamese word segmentation with SVM: ambiguity reduction and suffix capture,"DV Nguyen, D Van Thin, K Van Nguyen, NLT Nguyen",2020,3,https://scholar.google.com/citations?view_op=view_citation&hl=en&user=VoTCbXYAAAAJ&cstart=20&pagesize=80&citation_for_view=VoTCbXYAAAAJ:_Qo2XoVZTnwC
67,Effect of ice crystal size on the textural properties of ice cream and sorbet,"H Huynh, KK Yiu, NT Nguyen",2014,3,https://scholar.google.com/citations?view_op=view_citation&hl=en&user=VoTCbXYAAAAJ&cstart=20&pagesize=80&citation_for_view=VoTCbXYAAAAJ:8AbLer7MMksC
68,VLSP 2022--EVJVQA Challenge: Multilingual Visual Question Answering,"NLT Nguyen, NH Nguyen, DTD Vo, KQ Tran, K Van Nguyen",2023,2,https://scholar.google.com/citations?view_op=view_citation&hl=en&user=VoTCbXYAAAAJ&cstart=20&pagesize=80&citation_for_view=VoTCbXYAAAAJ:5Ul4iDaHHb8C
69,FormerLeaf: An efficient vision transformer for Cassava Leaf Disease detection,"HT Thai, KH Le, NLT Nguyen",2023,2,https://scholar.google.com/citations?view_op=view_citation&hl=en&user=VoTCbXYAAAAJ&cstart=20&pagesize=80&citation_for_view=VoTCbXYAAAAJ:p2g8aNsByqUC
70,XLMRQA: Open-Domain Question Answering on Vietnamese Wikipedia-Based Textual Knowledge Source,"KV Nguyen, PNT Do, ND Nguyen, TV Huynh, AGT Nguyen, NLT Nguyen",2022,2,https://scholar.google.com/citations?view_op=view_citation&hl=en&user=VoTCbXYAAAAJ&cstart=20&pagesize=80&citation_for_view=VoTCbXYAAAAJ:bFI3QPDXJZMC
71,SPBERTQA: A two-stage question answering system based on Sentence Transformers for medical texts,"NTH Nguyen, PPD Ha, LT Nguyen, K Van Nguyen, NLT Nguyen",2022,2,https://scholar.google.com/citations?view_op=view_citation&hl=en&user=VoTCbXYAAAAJ&cstart=20&pagesize=80&citation_for_view=VoTCbXYAAAAJ:abG-DnoFyZgC
72,Finding Nano-Ötzi: Cryo-Electron Tomography Visualization Guided by Learned Segmentation,"N Nguyen, C Bohak, D Engel, P Mindek, O Strnad, P Wonka, S Li, ...",2022,2,https://scholar.google.com/citations?view_op=view_citation&hl=en&user=VoTCbXYAAAAJ&cstart=20&pagesize=80&citation_for_view=VoTCbXYAAAAJ:EUQCXRtRnyEC
73,Exploring zero-shot cross-lingual aspect-based sentiment analysis using pre-trained multilingual language models,"KTK Phan, DN Hao, D Van Thin, NLT Nguyen",2021,2,https://scholar.google.com/citations?view_op=view_citation&hl=en&user=VoTCbXYAAAAJ&cstart=20&pagesize=80&citation_for_view=VoTCbXYAAAAJ:dfsIfKJdRG4C
74,Span Labeling Approach for Vietnamese and Chinese Word Segmentation,"DV Nguyen, LB Vo, DV Thin, NLT Nguyen",2021,2,https://scholar.google.com/citations?view_op=view_citation&hl=en&user=VoTCbXYAAAAJ&cstart=20&pagesize=80&citation_for_view=VoTCbXYAAAAJ:4OULZ7Gr8RgC
75,Vietnamese Context-Sensitive Malicious Spelling Error Correction,"LT Nguyen, BP Dao, DV Nguyen, NLT Nguyen",2020,2,https://scholar.google.com/citations?view_op=view_citation&hl=en&user=VoTCbXYAAAAJ&cstart=20&pagesize=80&citation_for_view=VoTCbXYAAAAJ:NaGl4SEjCO4C
76,A pilot study on multiple choice machine reading comprehension for vietnamese texts,"K Van Nguyen, KV Tran, ST Luu, AGT Nguyen, NLT Nguyen",2020,2,https://scholar.google.com/citations?view_op=view_citation&hl=en&user=VoTCbXYAAAAJ&cstart=20&pagesize=80&citation_for_view=VoTCbXYAAAAJ:HDshCWvjkbEC
77,Nlp@ uit at vlsp 2019: A simple ensemble model for vietnamese dependency parsing,"DV Nguyen, K Van Nguyen, NLT Nguyen",2019,2,https://scholar.google.com/citations?view_op=view_citation&hl=en&user=VoTCbXYAAAAJ&cstart=20&pagesize=80&citation_for_view=VoTCbXYAAAAJ:hFOr9nPyWt4C
78,Nlp@ uit at figlang-emnlp 2022: A divide-and-conquer system for shared task on understanding figurative language,"KTK Phan, DV Nguyen, NLT Nguyen",2022,1,https://scholar.google.com/citations?view_op=view_citation&hl=en&user=VoTCbXYAAAAJ&cstart=20&pagesize=80&citation_for_view=VoTCbXYAAAAJ:B3FOqHPlNUQC
79,Differentiable Electron Microscopy Simulation: Methods and Applications for Visualization,"N Nguyen, F Liang, D Engel, C Bohak, P Wonka, T Ropinski, I Viola",2022,1,https://scholar.google.com/citations?view_op=view_citation&hl=en&user=VoTCbXYAAAAJ&cstart=20&pagesize=80&citation_for_view=VoTCbXYAAAAJ:_xSYboBqXhAC
80,Vlsp 2021 shared task: Vietnamese machine reading comprehension,"K Van Nguyen, SQ Tran, LT Nguyen, T Van Huynh, ST Luu, NLT Nguyen",2022,1,https://scholar.google.com/citations?view_op=view_citation&hl=en&user=VoTCbXYAAAAJ&cstart=20&pagesize=80&citation_for_view=VoTCbXYAAAAJ:pyW8ca7W8N0C
81,VLSP 2021-vimrc challenge: Vietnamese machine reading comprehension,"K Van Nguyen, SQ Tran, LT Nguyen, T Van Huynh, ST Luu, NLT Nguyen",2022,1,https://scholar.google.com/citations?view_op=view_citation&hl=en&user=VoTCbXYAAAAJ&cstart=20&pagesize=80&citation_for_view=VoTCbXYAAAAJ:NhqRSupF_l8C
82,An Empirical Study for Vietnamese Constituency Parsing with Pre-training,"TV Tran, XT Pham, DV Nguyen, K Van Nguyen, NLT Nguyen",2021,1,https://scholar.google.com/citations?view_op=view_citation&hl=en&user=VoTCbXYAAAAJ&cstart=20&pagesize=80&citation_for_view=VoTCbXYAAAAJ:hMod-77fHWUC
83,Vietnamese facebook posts classification using fine-tuning bert,"DT Tuan, D Van Thin, VH Pham, NLT Nguyen",2020,1,https://scholar.google.com/citations?view_op=view_citation&hl=en&user=VoTCbXYAAAAJ&cstart=20&pagesize=80&citation_for_view=VoTCbXYAAAAJ:J_g5lzvAfSwC
84,A Vietnamese Dataset for Evaluating Machine Reading Comprehension,"K Van Nguyen, DV Nguyen, AGT Nguyen, NLT Nguyen",2020,1,https://scholar.google.com/citations?view_op=view_citation&hl=en&user=VoTCbXYAAAAJ&cstart=20&pagesize=80&citation_for_view=VoTCbXYAAAAJ:JV2RwH3_ST0C
85,A Multi-filter BiLSTM-CNN Architecture for Vietnamese Sentiment Analysis,"LS Le, DV Thin, NLT Nguyen, SQ Trinh",2020,1,https://scholar.google.com/citations?view_op=view_citation&hl=en&user=VoTCbXYAAAAJ&cstart=20&pagesize=80&citation_for_view=VoTCbXYAAAAJ:BqipwSGYUEgC
86,EDNII Error Detection Tool User Manual,"NLT Nguyen, Y Miyao",2012,1,https://scholar.google.com/citations?view_op=view_citation&hl=en&user=VoTCbXYAAAAJ&cstart=20&pagesize=80&citation_for_view=VoTCbXYAAAAJ:ULOm3_A8WrAC
87,A Multiple Choices Reading Comprehension Corpus for Vietnamese Language Education,"ST Luu, KT Hoang, TQ Pham, K Van Nguyen, NLT Nguyen",2023,,https://scholar.google.com/citations?view_op=view_citation&hl=en&user=VoTCbXYAAAAJ&cstart=20&pagesize=80&citation_for_view=VoTCbXYAAAAJ:VOx2b1Wkg3QC
88,Revealing Weaknesses of Vietnamese Language Models Through Unanswerable Questions in Machine Reading Comprehension,"SQ Tran, PNT Do, K Van Nguyen, NLT Nguyen",2023,,https://scholar.google.com/citations?view_op=view_citation&hl=en&user=VoTCbXYAAAAJ&cstart=20&pagesize=80&citation_for_view=VoTCbXYAAAAJ:fQNAKQ3IYiAC
89,Multi-stage transfer learning with BERTology-based language models for question answering system in vietnamese,"K Van Nguyen, PNT Do, ND Nguyen, AGT Nguyen, NLT Nguyen",2023,,https://scholar.google.com/citations?view_op=view_citation&hl=en&user=VoTCbXYAAAAJ&cstart=20&pagesize=80&citation_for_view=VoTCbXYAAAAJ:4fKUyHm3Qg0C
90,ViHOS: Hate Speech Spans Detection for Vietnamese,"PG Hoang, CD Luu, KQ Tran, K Van Nguyen, NLT Nguyen",2023,,https://scholar.google.com/citations?view_op=view_citation&hl=en&user=VoTCbXYAAAAJ&cstart=20&pagesize=80&citation_for_view=VoTCbXYAAAAJ:tS2w5q8j5-wC
